[
  {
    "kind": "program",
    "id": "apollo",
    "name": "Apollo program",
    "image_url": "https://upload.wikimedia.org/wikipedia/commons/0/0e/Apollo_program_insignia.jpg",
    "source_url": "https://commons.wikimedia.org/wiki/File:Apollo_program_insignia.jpg",
    "author": "NASA",
    "license_short": "Public domain",
    "license_url": "https://en.wikipedia.org/wiki/Public_domain"
  },
  {
    "kind": "mission",
    "id": "apollo8",
    "name": "Apollo 8",
    "image_url": "https://upload.wikimedia.org/wikipedia/commons/8/8b/Apollo-8-patch.png",
    "source_url": "https://commons.wikimedia.org/wiki/File:Apollo-8-patch.png",
    "author": "NASA",
    "license_short": "Public domain",
    "license_url": "https://en.wikipedia.org/wiki/Public_domain"
  },
  {
    "kind": "mission",
    "id": "apollo10",
    "name": "Apollo 10",
    "image_url": "https://upload.wikimedia.org/wikipedia/commons/6/64/Apollo-10-LOGO.png",
    "source_url": "https://commons.wikimedia.org/wiki/File:Apollo-10-LOGO.png",
    "author": "NASA",
    "license_short": "Public domain",
    "license_url": "https://en.wikipedia.org/wiki/Public_domain"
  },
  {
    "kind": "mission",
    "id": "apollo11",
    "name": "Apollo 11",
    "image_url": "https://upload.wikimedia.org/wikipedia/commons/2/27/Apollo_11_insignia.png",
    "source_url": "https://commons.wikimedia.org/wiki/File:Apollo_11_insignia.png",
    "author": "NASA",
    "license_short": "Public domain",
    "license_url": "https://en.wikipedia.org/wiki/Public_domain"
  },
  {
    "kind": "mission",
    "id": "apollo12",
    "name": "Apollo 12",
    "image_url": "https://upload.wikimedia.org/wikipedia/commons/8/8d/Apollo_12_insignia.png",
    "source_url": "https://commons.wikimedia.org/wiki/File:Apollo_12_insignia.png",
    "author": "NASA",
    "license_short": "Public domain",
    "license_url": "https://en.wikipedia.org/wiki/Public_domain"
  },
  {
    "kind": "mission",
    "id": "apollo13",
    "name": "Apollo 13",
    "image_url": "https://upload.wikimedia.org/wikipedia/commons/a/ac/Apollo_13-insignia.png",
    "source_url": "https://commons.wikimedia.org/wiki/File:Apollo_13-insignia.png",
    "author": "NASA",
    "license_short": "Public domain",
    "license_url": "https://en.wikipedia.org/wiki/Public_domain"
  },
  {
    "kind": "mission",
    "id": "apollo14",
    "name": "Apollo 14",
    "image_url": "https://upload.wikimedia.org/wikipedia/commons/d/d7/Apollo_14-insignia.png",
    "source_url": "https://commons.wikimedia.org/wiki/File:Apollo_14-insignia.png",
    "author": "NASA",
    "license_short": "Public domain",
    "license_url": "https://en.wikipedia.org/wiki/Public_domain"
  },
  {
    "kind": "mission",
    "id": "apollo15",
    "name": "Apollo 15",
    "image_url": "https://upload.wikimedia.org/wikipedia/commons/e/e5/Apollo_15-insignia.png",
    "source_url": "https://commons.wikimedia.org/wiki/File:Apollo_15-insignia.png",
    "author": "NASA",
    "license_short": "Public domain",
    "license_url": "https://en.wikipedia.org/wiki/Public_domain"
  },
  {
    "kind": "mission",
    "id": "apollo16",
    "name": "Apollo 16",
    "image_url": "https://upload.wikimedia.org/wikipedia/commons/6/66/Apollo-16-LOGO.png",
    "source_url": "https://commons.wikimedia.org/wiki/File:Apollo-16-LOGO.png",
    "author": "NASA",
    "license_short": "Public domain",
    "license_url": "https://en.wikipedia.org/wiki/Public_domain"
  },
  {
    "kind": "mission",
    "id": "apollo17",
    "name": "Apollo 17",
    "image_url": "https://upload.wikimedia.org/wikipedia/commons/7/76/Apollo_17-insignia.png",
    "source_url": "https://commons.wikimedia.org/wiki/File:Apollo_17-insignia.png",
    "author": "NASA",
    "license_short": "Public domain",
    "license_url": "https://en.wikipedia.org/wiki/Public_domain"
  },
  {
    "kind": "program",
    "id": "mercury",
    "name": "Project Mercury",
    "image_url": "https://upload.wikimedia.org/wikipedia/commons/0/07/Mercury_Program_insignia.svg",
    "source_url": "https://commons.wikimedia.org/wiki/File:Mercury_Program_insignia.svg",
    "author": "NASA",
    "license_short": "Public domain",
    "license_url": "https://en.wikipedia.org/wiki/Public_domain"
  },
  {
    "kind": "program",
    "id": "gemini",
    "name": "Project Gemini",
    "image_url": "https://upload.wikimedia.org/wikipedia/commons/f/fd/GeminiPatch.svg",
    "source_url": "https://commons.wikimedia.org/wiki/File:GeminiPatch.svg",
    "author": "NASA",
    "license_short": "Public domain",
    "license_url": "https://en.wikipedia.org/wiki/Public_domain"
  },
  {
    "kind": "program",
    "id": "skylab",
    "name": "Skylab program",
    "image_url": "https://upload.wikimedia.org/wikipedia/commons/2/25/Skylab_Program_Patch.png",
    "source_url": "https://commons.wikimedia.org/wiki/File:Skylab_Program_Patch.png",
    "author": "NASA",
    "license_short": "Public domain",
    "license_url": "https://en.wikipedia.org/wiki/Public_domain"
  },
  {
    "kind": "program",
    "id": "space-shuttle",
    "name": "Space Shuttle program",
    "image_url": "https://upload.wikimedia.org/wikipedia/commons/4/49/Space_Shuttle_Program_Commemorative_Patch.png",
    "source_url": "https://commons.wikimedia.org/wiki/File:Space_Shuttle_Program_Commemorative_Patch.png",
    "author": "NASA / Blake Dumesnil",
    "license_short": "Public domain",
    "license_url": "https://en.wikipedia.org/wiki/Public_domain"
  },
  {
    "kind": "program",
    "id": "iss",
    "name": "International Space Station",
    "image_url": "https://upload.wikimedia.org/wikipedia/commons/1/15/ISS_emblem.png",
    "source_url": "https://commons.wikimedia.org/wiki/File:ISS_emblem.png",
    "author": "NASA",
    "license_short": "Public domain",
    "license_url": "https://en.wikipedia.org/wiki/Public_domain"
  },
  {
    "kind": "mission",
    "id": "gemini4",
    "name": "Gemini 4",
    "image_url": "https://upload.wikimedia.org/wikipedia/commons/c/c8/Gemini_IV_mission_patch.webp",
    "source_url": "https://commons.wikimedia.org/wiki/File:Gemini_IV_mission_patch.webp",
    "author": "NASA",
    "license_short": "Public domain",
    "license_url": "https://en.wikipedia.org/wiki/Public_domain"
  },
  {
    "kind": "mission",
    "id": "gemini6a",
    "name": "Gemini 6A",
    "image_url": "https://upload.wikimedia.org/wikipedia/commons/1/10/Gemini_6A_patch.png",
    "source_url": "https://commons.wikimedia.org/wiki/File:Gemini_6A_patch.png",
    "author": "NASA",
    "license_short": "Public domain",
    "license_url": "https://en.wikipedia.org/wiki/Public_domain"
  },
  {
    "kind": "mission",
    "id": "gemini7",
    "name": "Gemini 7",
    "image_url": "https://upload.wikimedia.org/wikipedia/commons/d/d9/Gemini_VII_patch.png",
    "source_url": "https://commons.wikimedia.org/wiki/File:Gemini_VII_patch.png",
    "author": "NASA",
    "license_short": "Public domain",
    "license_url": "https://en.wikipedia.org/wiki/Public_domain"
  },
  {
    "kind": "mission",
    "id": "gemini8",
    "name": "Gemini 8",
    "image_url": "https://upload.wikimedia.org/wikipedia/commons/7/7a/Gemini_8_patch.png",
    "source_url": "https://commons.wikimedia.org/wiki/File:Gemini_8_patch.png",
    "author": "NASA",
    "license_short": "Public domain",
    "license_url": "https://en.wikipedia.org/wiki/Public_domain"
  },
  {
    "kind": "mission",
    "id": "gemini12",
    "name": "Gemini 12",
    "image_url": "https://upload.wikimedia.org/wikipedia/commons/0/0e/Gemini_12_insignia.png",
    "source_url": "https://commons.wikimedia.org/wiki/File:Gemini_12_insignia.png",
    "author": "NASA",
    "license_short": "Public domain",
    "license_url": "https://en.wikipedia.org/wiki/Public_domain"
  },
  {
    "kind": "mission",
    "id": "skylab-2",
    "name": "Skylab 2",
    "image_url": "https://upload.wikimedia.org/wikipedia/commons/5/55/Skylab2-Patch.png",
    "source_url": "https://commons.wikimedia.org/wiki/File:Skylab2-Patch.png",
    "author": "NASA",
    "license_short": "Public domain",
    "license_url": "https://en.wikipedia.org/wiki/Public_domain"
  },
  {
    "kind": "mission",
    "id": "skylab-3",
    "name": "Skylab 3",
    "image_url": "https://upload.wikimedia.org/wikipedia/commons/a/ab/Skylab3-Patch.png",
    "source_url": "https://commons.wikimedia.org/wiki/File:Skylab3-Patch.png",
    "author": "NASA",
    "license_short": "Public domain",
    "license_url": "https://en.wikipedia.org/wiki/Public_domain"
  },
  {
    "kind": "mission",
    "id": "skylab-4",
    "name": "Skylab 4",
    "image_url": "https://upload.wikimedia.org/wikipedia/commons/e/e1/Skylab4-Patch.png",
    "source_url": "https://commons.wikimedia.org/wiki/File:Skylab4-Patch.png",
    "author": "NASA",
    "license_short": "Public domain",
    "license_url": "https://en.wikipedia.org/wiki/Public_domain"
  },
  {
    "kind": "mission",
    "id": "apollo-soyuz",
    "name": "Apollo-Soyuz Test Project",
    "image_url": "https://upload.wikimedia.org/wikipedia/commons/a/a9/ASTP_patch.png",
    "source_url": "https://commons.wikimedia.org/wiki/File:ASTP_patch.png",
    "author": "NASA",
    "license_short": "Public domain",
    "license_url": "https://en.wikipedia.org/wiki/Public_domain"
  },
  {
    "kind": "program",
    "id": "spacex",
    "name": "SpaceX — Crew Dragon Demo-2",
    "image_url": "https://upload.wikimedia.org/wikipedia/commons/a/a9/Crew_Dragon_Demo-2_Patch.png",
    "source_url": "https://commons.wikimedia.org/wiki/File:Crew_Dragon_Demo-2_Patch.png",
    "author": "NASA",
    "license_short": "Public domain",
    "license_url": "https://en.wikipedia.org/wiki/Public_domain"
  },
  {
    "kind": "program",
    "id": "artemis",
    "name": "Artemis program",
    "image_url": "https://upload.wikimedia.org/wikipedia/commons/e/ee/Artemis_program_%28solid_without_wordmark%29.svg",
    "source_url": "https://commons.wikimedia.org/wiki/File:Artemis_program_(solid_without_wordmark).svg",
    "author": "NASA",